{
  "object_type": "record",
  "schema_version": "0.1.0",
  "record_type": "subject",
  "entity_id": "urn:uuid:10000000-0000-4000-8000-000000000001",
  "recorded_at": "2026-07-11T01:00:00.000000000Z",
  "asserted_by": "urn:uuid:00000000-0000-4000-8000-000000000001",
  "origin": "self_declared",
  "source_refs": [],
  "payload": {
    "subject_kind": "hybrid",
    "label": "North wall mural",
    "relation_refs": [],
    "spatial_frame_refs": []
  },
  "extensions": {}
}
