{
  "object_type": "record",
  "schema_version": "0.1.0",
  "record_type": "evidence_gap",
  "entity_id": "urn:uuid:10000000-0000-4000-8000-000000000008",
  "recorded_at": "2026-07-11T01:07:00.000000000Z",
  "asserted_by": "urn:uuid:00000000-0000-4000-8000-000000000001",
  "origin": "self_declared",
  "source_refs": [],
  "payload": {
    "subject_refs": ["urn:uuid:10000000-0000-4000-8000-000000000001"],
    "gap_kind": "not_captured",
    "affected_time": {
      "kind": "interval",
      "from": "2026-07-10T00:00:00.000000000Z",
      "to": "2026-07-11T00:00:00.000000000Z"
    },
    "expected_evidence_role": "primary",
    "reason": "The camera was offline during this interval.",
    "related_refs": []
  },
  "extensions": {}
}
