{
  "object_type": "record",
  "schema_version": "0.1.0",
  "record_type": "claim_reaction",
  "entity_id": "urn:uuid:10000000-0000-4000-8000-000000000004",
  "recorded_at": "2026-07-11T01:03:00.000000000Z",
  "asserted_by": "urn:uuid:00000000-0000-4000-8000-000000000001",
  "origin": "self_declared",
  "source_refs": [],
  "payload": {
    "claim_ref": "record:sg-oid-v1:sha256:aaaaaaaaaaaaaaaaaaaaaaaaaaaaaaaaaaaaaaaaaaaaaaaaaaaaaaaaaaaaaaaa",
    "reaction": "endorse",
    "reason": "Matches the signed restoration brief.",
    "evidence_refs": []
  },
  "extensions": {}
}
