{
  "object_type": "record",
  "schema_version": "0.1.0",
  "record_type": "claim",
  "entity_id": "urn:uuid:10000000-0000-4000-8000-000000000003",
  "recorded_at": "2026-07-11T01:02:00.000000000Z",
  "asserted_by": "urn:uuid:00000000-0000-4000-8000-000000000001",
  "origin": "self_declared",
  "source_refs": [],
  "payload": {
    "claim_kind": "interpretation",
    "epistemic_class": "declared",
    "subject_refs": ["urn:uuid:10000000-0000-4000-8000-000000000001"],
    "predicate": "uses_palette",
    "value_text": "The restored area uses the approved warm palette.",
    "evidence_refs": [],
    "confidence": {
      "kind": "probability",
      "value": { "mantissa": "5", "scale": -1, "unit": "ratio" },
      "calibrated": false
    },
    "alternative_claim_refs": [],
    "region_refs": [],
    "assumptions": [],
    "limitations": []
  },
  "extensions": {}
}
