{
  "object_type": "record",
  "schema_version": "0.1.0",
  "record_type": "capture_profile",
  "entity_id": "urn:uuid:10000000-0000-4000-8000-000000000005",
  "recorded_at": "2026-07-11T01:04:00.000000000Z",
  "asserted_by": "urn:uuid:00000000-0000-4000-8000-000000000001",
  "origin": "self_declared",
  "source_refs": [],
  "payload": {
    "profile_level": "repeatable",
    "required_conditions": ["color_reference", "station"],
    "allowed_claims": ["appearance_change_candidate"],
    "tolerances": {
      "viewpoint": { "mantissa": "2", "scale": -1, "unit": "deg" }
    },
    "description": "Repeatable wall capture profile"
  },
  "extensions": {}
}
