{
  "object_type": "record",
  "schema_version": "0.1.0",
  "record_type": "actor",
  "entity_id": "urn:uuid:00000000-0000-4000-8000-000000000001",
  "recorded_at": "2026-07-11T00:00:00.000000000Z",
  "asserted_by": "urn:uuid:00000000-0000-4000-8000-000000000001",
  "origin": "self_declared",
  "source_refs": [],
  "payload": {
    "actor_kind": "human",
    "display_name": "Aki",
    "description": "Café muralist"
  },
  "extensions": {}
}
