{
  "object_type": "record",
  "schema_version": "0.1.0",
  "record_type": "policy",
  "entity_id": "urn:uuid:00000000-0000-4000-8000-000000000030",
  "recorded_at": "2026-07-11T00:02:00.000000000Z",
  "asserted_by": "urn:uuid:00000000-0000-4000-8000-000000000001",
  "origin": "self_declared",
  "source_refs": [],
  "payload": {
    "scope_refs": ["urn:uuid:00000000-0000-4000-8000-000000000010"],
    "rules": [
      {
        "rule_id": "deny-external-training",
        "effect": "deny",
        "action": "train_external",
        "resource_selector": "project/**"
      },
      {
        "rule_id": "gate-release",
        "effect": "require_human_gate",
        "action": "publish",
        "resource_selector": "release/**",
        "human_gate": "before_release_ref"
      }
    ],
    "default_effect": "deny",
    "notes": "Creative work remains project-local unless the creator changes policy."
  },
  "extensions": {}
}
