{
  "object_type": "record",
  "schema_version": "0.1.0",
  "record_type": "delegation_grant",
  "entity_id": "urn:uuid:00000000-0000-4000-8000-000000000040",
  "valid_time": {
    "kind": "instant",
    "at": "2026-07-11T00:03:00.000000000Z",
    "precision": { "kind": "resolution", "value": { "mantissa": "1", "scale": 0, "unit": "s" } }
  },
  "recorded_at": "2026-07-11T00:03:00.000000000Z",
  "asserted_by": "urn:uuid:00000000-0000-4000-8000-000000000001",
  "origin": "self_declared",
  "source_refs": [],
  "payload": {
    "principal_ref": "urn:uuid:00000000-0000-4000-8000-000000000001",
    "delegate_ref": "urn:uuid:00000000-0000-4000-8000-000000000002",
    "project_ref": "urn:uuid:00000000-0000-4000-8000-000000000010",
    "purpose": "Explore color and layout variants without changing official history.",
    "capabilities": ["analyze", "propose_branch", "read_context"],
    "resource_selectors": ["project/**"],
    "writable_ref_prefixes": ["proposal/00000000-0000-4000-8000-000000000002"],
    "data_classes": ["confidential", "internal"],
    "allowed_egress": [],
    "may_delegate": false,
    "max_child_depth": 0,
    "max_output_bytes": 1048576,
    "required_human_gates": ["before_decision_ref", "before_external_egress", "before_release_ref"],
    "expires_at": "2026-07-12T00:03:00.000000000Z"
  },
  "extensions": {}
}
