{
  "object_type": "record",
  "schema_version": "0.1.0",
  "record_type": "actor",
  "entity_id": "urn:uuid:00000000-0000-4000-8000-000000000002",
  "recorded_at": "2026-07-11T00:01:00.000000000Z",
  "asserted_by": "urn:uuid:00000000-0000-4000-8000-000000000001",
  "origin": "self_declared",
  "source_refs": [],
  "payload": {
    "actor_kind": "ai_agent",
    "display_name": "Studio Copilot",
    "ai_profile": {
      "provider": "example.invalid",
      "model_id": "creative-model",
      "model_version": "2026-07",
      "capabilities": ["analyze", "propose_branch", "read_context"]
    },
    "description": "Fixture-only creative agent"
  },
  "extensions": {}
}
